match,start_time,market,home_team,home_win,away_team,away_win,margin,agency
Indianapolis Colts v San Francisco 49ers,2025-12-23T01:15:00Z,Head To Head,Indianapolis Colts,3.1,San Francisco 49ers,1.4,1.037,Pointsbet
Tennessee Titans v New Orleans Saints,2025-12-28T18:00:00Z,Head To Head,Tennessee Titans,2.3,New Orleans Saints,1.67,1.034,Pointsbet
Miami Dolphins v Tampa Bay Buccaneers,2025-12-28T18:00:00Z,Head To Head,Miami Dolphins,3,Tampa Bay Buccaneers,1.4,1.048,Pointsbet
Carolina Panthers v Seattle Seahawks,2025-12-28T18:00:00Z,Head To Head,Carolina Panthers,3.8,Seattle Seahawks,1.29,1.038,Pointsbet
New York Jets v New England Patriots,2025-12-28T18:00:00Z,Head To Head,New York Jets,7,New England Patriots,1.11,1.044,Pointsbet
Buffalo Bills v Philadelphia Eagles,2025-12-28T21:25:00Z,Head To Head,Buffalo Bills,1.71,Philadelphia Eagles,2.2,1.039,Pointsbet
